,Relevance,Tags,Heading,Seg,Sentence
866,1,"['simple random sampling', 'sampling', 'statistical', 'random', 'random numbers', 'random sampling']", Simple Random Sampling,seg_179,"nowadays, simple random sampling is done using random numbers in statistical software or a spreadsheet."
867,1,"['function', 'parameters']", Simple Random Sampling,seg_179,"in a spreadsheet, you can use the function rand. this function is used without any parameters:"
868,1,"['random number', 'random']", Simple Random Sampling,seg_179,¼rand() this provides a random number between 0 and 1.
869,1,"['sampling units', 'sampling frame', 'sampling']", Simple Random Sampling,seg_179,the general approach for selecting n sampling units from a sampling frame can be summarized as follows:
870,1,"['sample size', 'sample', 'sampling units', 'sampling unit', 'sampling frame', 'sampling', 'random', 'function', 'random numbers']", Simple Random Sampling,seg_179,"1. use the function rand for each sampling unit in the sampling frame. 2. sort all sampling units according to the value of the random numbers. 3. select the first n sampling units, where n is the required sample size."
871,1,"['random', 'sampling ', 'method', 'homogeneous', 'sampling', 'population', 'strata']", Stratified Sampling,seg_181,"stratified sampling (*) is a method of dividing the population into homogeneous groups, called strata (singular: stratum). within each group simple random sampling is used!"
872,1,"['sample size', 'sample', 'statistical uncertainty', 'uncertainty', 'homogeneous', 'statistical', 'strata']", Stratified Sampling,seg_181,"the main reason to do stratification is that we can reduce the statistical uncertainty significantly. conversely, we can reduce the sample size significantly without increasing the statistical uncertainty! this happens, if the strata are homogeneous, i.e., the spread within strata is small, while on the other hand, the spread between strata is large."
873,1,"['sample size', 'sample', 'information', 'population']", Stratified Sampling,seg_181,"let us as a hypothetical (?) example imagine that men and women are 100% divided with respect to the opinion on a particular issue. for instance, all men will answer “yes” to a certain question, while all women will answer “no”. in this situation the sample need not be very large in order to cover the population! in fact, a sample size of 2 is enough (one man and one woman)... there is no further information in a larger sample!"
874,0,[], Stratified Sampling,seg_181,"this example is of course entirely hypothetical! however, if the situation has a certain similarity with the hypothetical example, there will still be a huge gain by stratification. this is true if e.g., most men will answer “yes” to the question and most women will answer “no”."
875,1,"['sample', 'factors', 'data', 'variable', 'statistical']", Stratified Sampling,seg_181,"if we have data from an earlier sample survey, we can use these data to plan a new sample survey. often, there is one particular variable, which is the most important variable. then we can carry out some statistical calculations to determine the factors that have the greatest influence on this variable. the statistical techniques used for this purpose are extensions of the methods discussed in chaps. 5, 7, and 8."
876,0,[], Stratified Sampling,seg_181,other reasons for stratification may be:
877,0,[], Stratified Sampling,seg_181,1. administrative reasons. this might be stratification according to geographical
878,1,"['simple random sampling', 'statistical uncertainty', 'uncertainty', 'sampling', 'strata', 'random', 'statistical', 'random sampling']", Stratified Sampling,seg_181,"criteria. in this situation, the statistical uncertainty will rarely be reduced much compared to simple random sampling; it may even be larger. 2. groups (strata) have an interest in itself. we want to ensure that all strata are"
879,1,"['sample', 'sampling', 'population']", Stratified Sampling,seg_181,"adequately represented in the sample. this is particularly important, if there are small groups in the population, which have our particular interest. 3. sampling is conducted according to different principles in different groups of"
880,1,"['sampling', 'population']", Stratified Sampling,seg_181,"the population. for example, some people live in institutions rather than ordinary households. the practical problems involved in sampling are very different."
881,1,"['sample', 'strata']", Stratified Sampling,seg_181,"in the fitness club sample survey, stratifying by age will probably be a good idea. there is in virtually every aspect very big differences between a 12-year-old and a 17-year-old. . .we could have two strata: kids 12–14 years old and kids 15–17 years old. it might also make sense to stratify by sex. it depends on the main purpose of the survey. you can also stratify after both age and sex, for example, using four strata in total."
882,1,"['sample', 'weighted average', 'cases', 'population', 'average']", Stratified Sampling,seg_181,"how many individuals should be selected from each stratum? normally, we will select a number of individuals in each stratum, corresponding to its size in the population. if one group is twice as large as another, we must select twice as many individuals in this group compared to the other. in some cases we will over-sample some groups and under-sample others. for example, some groups are of particular interest. in these cases, we must calculate a weighted average, when calculating an average from the sample. that is, we multiply each group average with its weight from the population. if one group in the population is twice as large as another, this average should count twice as much as the other average."
883,1,"['sampling ', 'sampling units', 'sampling frame', 'sampling']", Cluster Sampling,seg_183,"cluster sampling (*) is based on a sampling frame, consisting of sampling units, which in turn contain several analysis units."
884,1,"['simple random sampling', 'sampling unit', 'sampling', 'random', 'random sampling']", Cluster Sampling,seg_183,"the classic example is a household, which consists of several people. we select a number of households by simple random sampling. we can then select one person, all persons or for instance half of the persons from the household. in this context the sampling unit (a household) is often called a cluster."
885,1,"['sampling', 'sampling frame']", Cluster Sampling,seg_183,"cluster sampling is used mainly for administrative reasons. you may have access to a sampling frame consisting of households, but not a sampling frame of persons."
886,1,"['simple random sampling', 'statistical uncertainty', 'uncertainty', 'sampling', 'associated', 'cluster sampling', 'random', 'statistical', 'random sampling']", Cluster Sampling,seg_183,the statistical uncertainty associated with cluster sampling will usually be larger than when simple random sampling is used. this happens when the individuals in a cluster are similar.
887,0,[], Cluster Sampling,seg_183,"assume that we are interested in the television viewing of adult persons. in most households consisting of two adults, they will watch a television program together. if you ask them, which television programs they saw the day before, you"
888,1,"['response', 'information']", Cluster Sampling,seg_183,"will get the same response from both adults in the household! there is, in other words, no additional information asking both adults as compared to asking only one of them!"
889,1,['population'], Cluster Sampling,seg_183,"of course, this is a simplified description. for example one of them may be shopping, while the other watches television at home. as long as the population consists of only adults, this description is, however, reasonably correct."
890,1,"['simple random sampling', 'statistical uncertainty', 'uncertainty', 'sampling', 'cases', 'cluster sampling', 'random', 'statistical', 'random sampling']", Cluster Sampling,seg_183,in some cases cluster sampling has smaller statistical uncertainty than when simple random sampling is used. this happens if there are large differences between the individuals in a cluster.
891,1,['population'], Cluster Sampling,seg_183,"assume that we still restrict the population to adults, and we are interested in their consumption of sanitary towels. this situation is just the reverse: households with two adults will most often be one person of each sex; therefore, there will be a very large difference in their consumption of sanitary towels!"
892,1,['sampling'], Cluster Sampling,seg_183,the sampling of school children in a specific school may be carried out in two stages:
893,1,"['simple random sampling', 'sampling', 'random', 'random sampling']", Cluster Sampling,seg_183,"– first, we select a number of classes by simple random sampling from a sampling"
894,1,['random'], Cluster Sampling,seg_183,frame of all classes. – then we select a number of children from each selected class by simple random
895,1,"['sampling', 'cluster sampling']", Cluster Sampling,seg_183,"we use cluster sampling, because it only requires lists of children in the classes, which have been selected!"
896,1,"['simple random sampling', 'sampling units', 'sampling', 'random', 'random sampling']", Cluster Sampling,seg_183,how to select sampling units and analysis units? we select a number of sampling units by simple random sampling. this step has (at least) two options:
897,1,"['sampling units', 'sampling unit', 'sampling', 'probability']", Cluster Sampling,seg_183,"– sampling units are selected with the same probability. – sampling units are selected with a probability proportional to their size. the larger a sampling unit (e.g., household or school class), the larger the probability of selection."
898,1,"['sampling', 'sampling unit']", Cluster Sampling,seg_183,"from each sampling unit, one or more analysis units are selected. this step has several options:"
899,0,[], Cluster Sampling,seg_183,– to select one analysis unit. – to select all the analysis units. (continued)
900,1,"['sampling', 'sampling unit']", Cluster Sampling,seg_183,"– to select a number of analysis units proportional to the size of the sampling unit. the larger a sampling unit, the more analysis units must be selected."
901,0,[], Cluster Sampling,seg_183,the topic is very large. we refer to specialized books on the topic.
902,1,"['randomization', 'sampling', 'sampling frame']", Systematic Sampling,seg_185,"if you do not have a sampling frame in the form of a database, you can use systematic sampling, which despite the name is based on randomization!"
903,1,"['simple random sampling', 'method', 'sampling', 'random', 'random sampling']", Systematic Sampling,seg_185,systematic sampling can be seen as a practically feasible approach in situations where simple random sampling is not feasible! the method is best illustrated by an example.
904,1,['sample'], Systematic Sampling,seg_185,"in the fitness club survey, we have a list of all kids in the club. there are 300 in total; we select 30 kids for the sample. we must therefore select every tenth kid from the list."
905,1,"['sampling', 'randomization']", Systematic Sampling,seg_185,the only randomization in this sampling approach is the selection of the first kid!
906,1,"['random number', 'random']", Systematic Sampling,seg_185,"– we choose a random number between 1 and 10, for example 7. we choose kid"
907,0,[], Systematic Sampling,seg_185,"no. 7 from the list. – then we select every tenth kid from the list. this means, that we will select"
908,1,['method'], Systematic Sampling,seg_185,"the method can be used to select customers entering a shop, who should participate in a questionnaire survey. if every tenth customer is to be selected, we can use exactly the same approach."
909,1,"['simple random sampling', 'statistical uncertainty', 'uncertainty', 'case', 'sampling', 'random', 'statistical', 'random sampling']", Systematic Sampling,seg_185,"the statistical uncertainty may be larger or smaller, than when simple random sampling is used. it is very difficult to tell a priori, what will be the case."
910,1,"['randomization', 'sampling', 'random', 'random error', 'error']", Quota Sampling,seg_187,"we now briefly discuss some methods of sampling, which are not based on a randomization mechanism. this should be avoided if possible, because we are not able to assess the size of the random error!"
911,1,"['simple random sampling', 'randomization', 'sampling frame', 'sampling', 'random', 'random sampling']", Quota Sampling,seg_187,"having said that, there are situations where randomization is not feasible. quota sampling is typically used in situations where the interviewer is in e.g., a shopping mall. simple random sampling of customers is not feasible. it is not possible to prepare a sampling frame."
912,0,[], Quota Sampling,seg_187,"instead, the interviewer will have a number quota to be “filled”. often we use a number of age groups for each sex: e.g., men aged 15–29, 30–44, etc. the interviewer needs a number of persons in each group."
913,1,['population'], Quota Sampling,seg_187,"the interviewer has opportunity to “spot” potential candidates for each group, as they appear. in this way it seems that we cover the population in a reasonable “representative” manner. however, we do not have any opportunity to demonstrate, that this is true. . ."
914,1,"['sample', 'statistical uncertainty', 'uncertainty', 'biased', 'statistical']", Quota Sampling,seg_187,"the sample may be “representative” in terms of sex and age. but there may be a number of other criteria, where the sample is biased (“unbalanced”), and we do not know anything about it! at the same time we have no idea about the size of the statistical uncertainty!"
915,1,"['sample', 'sampling units', 'randomization', 'sampling', 'population']", Purposive Sampling,seg_189,"this technique is used as an easy way to get a quick sample, which is similar to the population. we may have detailed knowledge about the population, so that we can sample a few “typical” sampling units. this is done quite purposively, without any kind of randomization."
916,1,"['sample', 'population']", Purposive Sampling,seg_189,"if we are lucky (and clever!) we can thereby obtain a sample, which is very similar to the population."
917,1,"['sampling', 'sampling unit']", Purposive Sampling,seg_189,the sampling unit will often be an administrative unit consisting of several analysis units.
918,1,"['sampling', 'method']", Purposive Sampling,seg_189,the drawbacks of this method are the same as for quota sampling.
919,1,['sampling'], Purposive Sampling,seg_189,"early exit polls after elections can be produced by selection a few “typical” municipalities, which “reflect” the nation quite precisely. in each municipality we select a few polling stations, using our knowledge about the municipality to “cover” the municipality “representatively”. in each polling station we ask a number of voters, how they voted. the selection of these voters could be done by e.g., systematic sampling."
920,1,['sample'], Convenience Sampling,seg_191,"the sample is selected “haphazardly”. it may be volunteers, “friends and relatives,” etc."
921,1,"['sample', 'statistical']", Convenience Sampling,seg_191,such sample surveys have no statistical value!
922,1,"['samples', 'statistical', 'test']", Convenience Sampling,seg_191,"see discussion on internet polls and telephone polls, etc. earlier in this chapter. however, this type of samples need not totally be condemned: they can be useful to test (parts of) a questionnaire in order to assess whether the wording of one or more questions needs to be changed. this is often called a pilot survey. we are only interested in a qualitative (not a statistical) evaluation of the questionnaire!"
923,1,"['sample', 'experiment', 'data']", Convenience Sampling,seg_191,"in chap. 5, we discussed how to analyze qualitative data from a sample survey or an experiment."
924,1,"['sample', 'quantitative', 'experiment', 'data']", Convenience Sampling,seg_191,"in this chapter we have discussed various aspects in connection with planning a sample survey or an experiment. in the next two chapters, we describe, how we can analyze quantitative data from a sample survey or an experiment."
925,1,['variables'],Chapter  Assessment of Relationship,seg_193,"in many different disciplines you need to assess, whether there is a relationship between two variables. this can be in administration, social sciences, economics, industry, and science."
926,0,[],Chapter  Assessment of Relationship,seg_193,the purpose could be one of the following:
927,0,[],Chapter  Assessment of Relationship,seg_193,– to get a basic understanding of a subject area – to find reasons or explanations of phenomena – to try to predict future developments
928,1,['statistical'],Chapter  Assessment of Relationship,seg_193,we study some techniques to assess a relationship and assess whether an apparent relationship is real or just a statistical coincidence.
929,1,"['plot', 'linear', 'variables', 'regression analysis', 'regression', 'linear regression']",Chapter  Assessment of Relationship,seg_193,"the technique is called regression analysis (*). we will only consider the basic technique, linear regression, which assumes that there is a linear relationship between two variables, i.e., a plot of y against x shows a number of points scattered around a straight line."
930,1,"['dependent variable', 'independent', 'variables', 'independent variable', 'dependent', 'variable']",Chapter  Assessment of Relationship,seg_193,one of the variables is the y-variable or dependent variable. the other variable is the x-variable or the independent variable.
931,0,[],Chapter  Assessment of Relationship,seg_193,"the subject is treated fairly briefly. we refer to the literature list, if you want to study the issue thoroughly."
932,1,"['statistical', 'regression analysis', 'regression']",Chapter  Assessment of Relationship,seg_193,"the calculations are quite complicated. you can use an advanced calculator with built-in regression analysis, but you are better off with a spreadsheet or statistical software."
933,1,"['nonlinear regression', 'regression analysis', 'nonlinear', 'regression', 'multiple regression', 'statistical']",Chapter  Assessment of Relationship,seg_193,"there are also more advanced types of regression analysis, for instance nonlinear regression or multiple regression (multiple x-variables). you can read more in many of the books from the literature list or study the help facility in your spreadsheet or other statistical software."
934,1,"['linear', 'linear regression', 'regression']",Chapter  Assessment of Relationship,seg_193,"this chapter discusses the fundamental concepts of linear regression, with a practical example. we do not show the calculation formulas for the different"
935,0,[],Chapter  Assessment of Relationship,seg_193,"statistics. these formulas are only important, if you do not have a spreadsheet (or other software) or an advanced calculator to do the calculations!"
936,1,"['functions', 'statistical']",Chapter  Assessment of Relationship,seg_193,"here, we use statistical functions of microsoft excel, open office calc, and several other spreadsheets. microsoft excel also has additional options in the add-in menu “data analysis”, under the item “regression”."
937,0,[],Chapter  Assessment of Relationship,seg_193,it is important to use these techniques critically. ask questions such as:
938,1,['linear'],Chapter  Assessment of Relationship,seg_193,– is there a relationship? – is it a linear relationship? – is there causality?
939,1,"['linear', 'variables', 'statistics', 'nonlinear', 'statistical']",Chapter  Assessment of Relationship,seg_193,"note: statistics can tell, whether there is a statistical relationship between two variables, whether it is linear or possibly more complicated (nonlinear). but statistics cannot tell, whether one phenomenon is the cause of another, i.e., whether there is a causal relationship. here professional knowledge is needed."
940,1,"['plot', 'variables', 'variable']",Chapter  Assessment of Relationship,seg_193,"many variables in the social and natural sciences increase with time. in this situation, a plot of any variable against any other variable will show a reasonably clear relationship."
941,1,"['variables', 'results', 'statistical', 'error']",Chapter  Assessment of Relationship,seg_193,"however, this is a statistical relationship, not a causal relationship. the real relationship, which is hidden in this way, is an increase with time for both variables. this is a fairly common error in connection with interpretation of statistical results."
942,0,[],Chapter  Assessment of Relationship,seg_193,"assume that the number of storks and the number of children in a given area increase in a certain period of time; you cannot conclude that the storks are coming with the children! this is a kind of false conclusion, we often find in newspaper articles."
943,1,['variable'],Chapter  Assessment of Relationship,seg_193,"the underlying (third) variable need not be time, but often it is."
944,0,[], Example,seg_195,let us consider the height and weight of the 17 boys in the fitness club survey.
945,1,['linear'], Example,seg_195,we ask the following question: is there a (possibly linear) relationship between height (x) and weight (y)?
946,1,['dependent'], Example,seg_195,"we assume that the weight is dependent on the height. therefore, we put height as x and weight as y."
947,1,['loss'], Example,seg_195,"one purpose could be to identify boys, who weigh too much compared to their height; these boys might be interested in an intensive weight loss program!"
948,1,"['plot', 'method', 'data', 'least squares', 'method of least squares']", Example,seg_195,"the first step is always to plot data. the following is a plot of weight vs. height. in addition, we can see the straight line that makes the best fit to data. this line is established by the method of least squares (*). see the literature list for books with a detailed review of the"
949,1,"['regression line', 'regression']", Example,seg_195,method. the line is called the regression line (*). see the help of your spreadsheet how to do this (fig. 7.1).
950,1,"['model', 'data', 'statistical model', 'statistical']", Example,seg_195,"a statistical model can describe these data. it describes the weight y of a randomly chosen boy, knowing his height x, through the equation"
951,0,['e'], Example,seg_195,if we ignore the term e that is precisely the equation for a straight line. here
952,1,"['random', 'residual', 'random variation', 'intercept', 'regression', 'variation', 'regression line', 'slope']", Example,seg_195,"x ¼ height of a boy y ¼ weight of a boy a ¼ intercept (on y-axis) of the regression line b ¼ slope of the regression line e ¼ random variation of y (for a given value of x), often called residual"
953,1,"['linear', 'curve', 'transformed', 'nonlinear', 'data', 'function', 'transforming']", Example,seg_195,"sometimes, data need to be transformed in order to obtain a linear relationship. if the points tend to be grouped around a (nonlinear) curve, a seemingly nonlinear relationship can become linear by transforming y and/or x, e.g., with the logarithm function. in the graph with weight plotted against height, there is no immediate sign of a nonlinear relationship."
954,1,"['linear', 'table', 'correlation', 'correlation coefficient', 'coefficient']", Example,seg_195,"to describe the degree of (linear) relationship between x and y we use the correlation coefficient (*), often simply called the correlation and labeled with the letter r (table 7.1)."
955,0,[], Example,seg_195,"this is illustrated in fig. 7.3. practical situations are usually not that clear-cut! the graph with weight plotted against height is equivalent to a situation where r > 0. by visual inspection, most people will probably find that r may be closer to 1 than to 0. we will determine r below."
956,1,"['linear', 'variation']", Example,seg_195,"sometimes we use r2, i.e., the squared value of r, which is a number between 0 and 1, as a measure of the degree of (linear) relationship between x and y. it is often written r2 (i.e., with capital “r”) or r-square. it is also called the coefficient of determination. you can say that r2 expresses how large a part of the variation in y is, which is “explained” by x."
957,1,"['model', 'transform']", Example,seg_195,"this can be used to compare different models. it can sometimes be difficult to see from a graph, whether we should transform, e.g., the y-variable or not (typically with the logarithm). if it is difficult to see from the graph, we can choose the model that gives the highest value of r-square."
958,1,"['plot', 'linear', 'data']", Example,seg_195,please note that a relatively high value of r-square is not a guarantee that a linear relationship is an adequate description of data. always study the plot also!
959,1,['data'], Linear Regression with Spreadsheets,seg_197,"data for the boys are shown below, but only the first few rows. data continue until row 18 in the spreadsheet (fig. 7.4)."
960,1,"['functions', 'linear', 'regression', 'linear regression']", Linear Regression with Spreadsheets,seg_197,"to perform linear regression, we use the following spreadsheet functions:"
961,1,['slope'], Linear Regression with Spreadsheets,seg_197,intercept slope correl rsq forecast
